{
  "contractVersion": "1.0.0",
  "package": {
    "id": "01a0132c-4eef-7703-94ac-ec8b5e66a001",
    "version": "1.0.0",
    "name": "Daggerheart Core 护甲测试资源包",
    "description": "用于验证护甲 Template、原生路由与 Player 字段物化。"
  },
  "targets": [
    {
      "systemPackageId": "01a0132c-4eef-7703-94ac-ec8d1a660001",
      "version": "1.0.0"
    }
  ],
  "license": {
    "label": "PbDH test fixture",
    "declaration": "数据迁移自 PbDH_Sheet 的 Daggerheart Core 官方护甲资源，仅用于 PbDH 合约与 Player 路由测试。"
  },
  "forkSource": null,
  "assets": [],
  "resources": [
    {
      "id": "01a0132c-4eef-7703-94ac-ec8c02654a01",
      "path": "护甲/填充布甲.json",
      "template": {
        "id": "护甲",
        "version": "1.0.0"
      },
      "presentation": {
        "width": "63",
        "height": "88",
        "unit": "mm",
        "mode": "text",
        "fixedRatio": true
      },
      "data": {
        "名称": "填充布甲",
        "类型": "护甲",
        "护甲值": "3",
        "重度伤害阈值": "5",
        "严重伤害阈值": "11",
        "描述": ":red[**灵活**]：闪避值+1。",
        "风味描述": "",
        "位阶": "1"
      },
      "media": {}
    }
  ],
  "emptyDirectories": [],
  "snapshotDigest": "sha256:d66ac8c4bacef522eabc65cb0f8dce4bdfa915c768074020a4fc6505bba231fe"
}
